{"$schema":"https://json-schema.org/draft/2020-12/schema","$id":"https://github.com/d6g8k5htny-coder/meta-framework/schemas/source_manifest.schema.json","title":"Universal Law source manifest v1","type":"object","required":["schema_version","distribution","version","repository","commit","scientific_status_authority","files"],"properties":{"schema_version":{"const":"1.0"},"distribution":{"type":"string","minLength":1},"version":{"type":"string","minLength":1},"repository":{"enum":["d6g8k5htny-coder/Math-","d6g8k5htny-coder/google-drive","d6g8k5htny-coder/governance-","d6g8k5htny-coder/main","d6g8k5htny-coder/meta-framework","d6g8k5htny-coder/query-","d6g8k5htny-coder/trial"]},"commit":{"type":"string","pattern":"^[0-9a-f]{40}$"},"scientific_status_authority":{"const":false},"files":{"type":"array","items":{"type":"object","required":["path","sha256","bytes"],"properties":{"path":{"type":"string"},"sha256":{"type":"string","pattern":"^[0-9a-f]{64}$"},"bytes":{"type":"integer","minimum":0}},"additionalProperties":true}}},"additionalProperties":true}
