{"schema_version":"1.0","distribution":"universal-law-query","version":"0.1.0","repository":"d6g8k5htny-coder/query-","commit":"aaaaaaaaaaaaaaaaaaaaaaaaaaaaaaaaaaaaaaaa","scientific_status_authority":false,"files":[{"path":"src/universal_law_query/__init__.py","sha256":"bbbbbbbbbbbbbbbbbbbbbbbbbbbbbbbbbbbbbbbbbbbbbbbbbbbbbbbbbbbbbbbb","bytes":1}]}
